{
  "schema": "devorch.task_contract.v1",
  "task_id": "DT-0001-r1",
  "contract_version": 1,
  "kind": "code_review",
  "linear_issue": null,
  "merc_issue": "MERC-101",
  "assigned_agent": "mdev-code-reviewer",
  "objective": "Independent review of DT-0001 attempt 1 (MERC-101) for correctness, interface compliance, error handling and test completeness.",
  "requirements": [
    "NFR-072",
    "NFR-062",
    "SEC-501",
    "CON-013",
    "NFR-092"
  ],
  "dependencies": [],
  "approved_design_refs": [
    "docs/mercury/architecture/components.md§2@4cad0ef217ae938182454b3dba8b54570d36ba4a",
    "docs/mercury/operations/macos-service.md§2@4cad0ef217ae938182454b3dba8b54570d36ba4a",
    "docs/mercury/architecture/decisions/ADR-016-filesystem-layout.md@4cad0ef217ae938182454b3dba8b54570d36ba4a"
  ],
  "allowed_paths": [
    "(read-only)"
  ],
  "restricted_paths": [
    "**"
  ],
  "interface_contracts": [
    {
      "path": "src/ports/clock.ts",
      "sha256": "5d41402abc4b2a76b9719d911017c592ae2f1c3f0a5e1b9c8d7e6f5a4b3c2d1e",
      "frozen_by": "DT-0002"
    }
  ],
  "acceptance_criteria": [
    "TC-UNIT-061, TC-OPS-003, TC-SEC-150 pass",
    "No parameter value hard-coded outside the config module",
    "Redactor applied on every log sink"
  ],
  "required_tests": [
    {
      "id": "TC-UNIT-061",
      "command": "npm test -- test/unit/core/config",
      "env": "T1"
    },
    {
      "id": "TC-OPS-003",
      "command": "npm test -- test/unit/core/paths",
      "env": "T1"
    },
    {
      "id": "TC-SEC-150",
      "command": "npm test -- test/unit/core/log/redactor",
      "env": "T1"
    },
    {
      "id": "typecheck",
      "command": "npm run typecheck",
      "env": "T0"
    }
  ],
  "required_reviewers": [],
  "required_gates": [
    "G3"
  ],
  "mercury_gates": [],
  "security_sensitive": true,
  "branch": "dev/merc-101-skeleton",
  "worktree": "/Users/operator/src/mercury-wt/DT-0001",
  "base_commit": "4cad0ef217ae938182454b3dba8b54570d36ba4a",
  "evidence_dir": "/Users/operator/src/mercury-devorch/evidence/DT-0001-r1/attempt-1",
  "status": "READY",
  "attempt": 1,
  "budget": {
    "max_attempts": 2,
    "max_turns": 60,
    "max_wall_minutes": 60
  },
  "created_at": "2026-10-20T09:00:00Z",
  "created_by": "principal-orchestrator",
  "review_target": {
    "implementation_task_id": "DT-0001",
    "base_commit": "4cad0ef217ae938182454b3dba8b54570d36ba4a",
    "head_commit": "2a4b6c8d0e1f2a3b4c5d6e7f8091a2b3c4d5e6f7"
  }
}