{"schema": "devorch.task_contract.v1", "task_id": "DT-0001-s1", "contract_version": 1, "kind": "security_review", "linear_issue": null, "merc_issue": null, "assigned_agent": "mdev-security-engineer", "objective": "test objective here", "requirements": [], "dependencies": [], "approved_design_refs": ["docs/x.md\u00a71@a39b1550333e5e5b20003720a65afa27bad32f6c"], "allowed_paths": [], "restricted_paths": ["docs/**", ".github/**"], "interface_contracts": [], "acceptance_criteria": ["works"], "required_tests": [{"id": "TC-UNIT-061", "command": "npm test -- test/unit/core/config", "env": "T1"}, {"id": "TC-SEC-150", "command": "npm test -- test/unit/core/log/redactor", "env": "T1"}, {"id": "typecheck", "command": "npm run typecheck", "env": "T0"}], "required_reviewers": [], "required_gates": ["G1", "G2", "G3", "G4", "G5", "G6", "G7"], "security_sensitive": false, "branch": "dev/merc-101-skeleton", "worktree": "/tmp/devorch-test-x402s51q/repo", "base_commit": "a39b1550333e5e5b20003720a65afa27bad32f6c", "evidence_dir": "/tmp/devorch-test-x402s51q/evidence/DT-0001-s1/attempt-1", "status": "READY", "attempt": 1, "budget": {"max_attempts": 3, "max_turns": 10, "max_wall_minutes": 30}, "created_at": "2026-10-15T00:00:00Z", "created_by": "principal-orchestrator", "parent_task_id": "DT-0001", "review_target": {"implementation_task_id": "DT-0001", "base_commit": "a39b1550333e5e5b20003720a65afa27bad32f6c", "head_commit": "583b776a7dcc849d5b606620bddffdb4b29627a4"}}