{"schema": "devorch.task_contract.v1", "task_id": "DT-0001-i1", "contract_version": 1, "kind": "integration", "linear_issue": null, "merc_issue": null, "assigned_agent": "mdev-integration-release-engineer", "objective": "test objective here", "requirements": [], "dependencies": [], "approved_design_refs": ["docs/x.md\u00a71@0468cc891e85e627f410233c733584cb286cc86a"], "allowed_paths": [], "restricted_paths": ["docs/**", ".github/**"], "interface_contracts": [], "acceptance_criteria": ["works"], "required_tests": [], "required_reviewers": [], "required_gates": ["G1", "G2", "G3", "G4", "G5", "G6", "G7"], "security_sensitive": false, "branch": "dev/dt-0001-int-w1-1", "worktree": "/tmp/devorch-test-uy_fj67w/repo", "base_commit": "0468cc891e85e627f410233c733584cb286cc86a", "evidence_dir": "/tmp/devorch-test-uy_fj67w/evidence/DT-0001-i1/attempt-1", "status": "READY", "attempt": 1, "budget": {"max_attempts": 3, "max_turns": 10, "max_wall_minutes": 30}, "created_at": "2026-10-15T00:00:00Z", "created_by": "principal-orchestrator", "covers_tasks": ["DT-0001"]}